id,product_name,company_name,manufacturing_date,expiration_date,serial_number,storage_instructions
9327,quasi,Freitas Pires - EI,2024-01-28,2116-05-22,WZ61 XTRC 2640 12AY H9W7 IL5X 4S0K,Neque unde voluptates rem odit nulla. Quaerat molestias nesciunt aliquid fuga. Eos doloribus est sint sunt. Dicta cumque ipsam reprehenderit nesciunt harum.
5619,illum,Freitas Pires - EI,2023-10-27,2102-08-06,G775 TJES 3791 7IC7 Q3N3 P555 M01E,Repellendus atque tenetur nesciunt. Qui ratione voluptate possimus.
7762,accusamus,Freitas Pires - EI,2023-11-30,2099-02-26,1W26 LGFP 5942 9P4U E2H1 QBU0 QL0S,Fuga dolores porro reprehenderit temporibus quidem quasi. Quod nesciunt aperiam. Quis consequuntur tempora quo eveniet.
6726,id,da Rocha,2024-06-22,2024-07-31,VP61 JZUB 6940 6TUS Z8Q2 HM8L GC7H,Odit aperiam omnis nostrum debitis. Nesciunt cumque consectetur sapiente occaecati consequuntur magnam nemo. Ad voluptate voluptatem eaque eveniet expedita quas.
5968,magni,Sales Rezende S/A,2023-07-30,2072-04-17,6027 5A5C 6288 7ZSY A0W4 DIAS 0752,Nemo repudiandae voluptatum minima. Ducimus eaque voluptatibus consequuntur esse voluptate.
